status_id,status_message,link_name,status_type,status_link,status_published,num_reactions,num_comments,num_shares,num_likes,num_loves,num_wows,num_hahas,num_sads,num_angrys
228735667216_10153782639552217,"On day one of the Democratic National Convention, Bernie Sanders supporters are still not giving up on their candidate or his ideas.",'Clinton as bad as Trump' say Bernie backers,link,http://bbc.in/2asN4Bb,2016-07-25 18:22:21,1169,212,104,995,79,5,21,9,61
228735667216_10153782534422217,"Nearly 3,000 firefighters are working to contain the California blaze.","10,000 homes evacuated from path of Sand Fire",link,http://bbc.in/2a5cdi0,2016-07-25 17:21:32,705,71,109,469,3,61,0,172,0
228735667216_10153782455027217,"Plans drawn up in the Cold War show the BBC intended on operating from 11 underground bunkers across the country in the event of a ""nuclear exchange"".",The BBC's detailed plans for nuclear war,link,http://bbc.in/2apdHas,2016-07-25 16:49:54,487,91,77,430,2,37,11,6,1
228735667216_10153782206867217,"As Prince Harry admits he didn't speak for years about the effect of his mother's death, how best can adults help and talk to children about bereavement?",How to help a child cope with a death?,link,http://bbc.in/2alygBV,2016-07-25 15:14:47,4579,245,525,3488,323,13,2,753,1
228735667216_10153782128132217,I could've danced all night...🎶,"Tribute to Marni Nixon, Hollywood's ""invisible voice""",link,http://bbc.in/2aqT6zn,2016-07-25 14:34:56,2372,65,275,1886,148,10,1,327,0
228735667216_10153782058347217,We'll have two strips of tickets please!,Couple make their tropical island resort a raffle prize,link,http://bbc.in/29V3q4P,2016-07-25 14:00:14,591,40,46,568,10,13,0,0,0
228735667216_10153782009602217,"Bernie Sanders is booed by supporters after urging them to support Hillary Clinton's bid for the presidency.

Follow coverage of the #DemsInPhilly: http://bbc.in/2anHaQH",Sanders booed,video,https://www.facebook.com/bbcnews/videos/10153782009602217/,2016-07-25 13:34:42,1778,530,357,1135,33,41,261,263,45
228735667216_10153781905997217,So that's what the snitch looks like!,Aussies win Quidditch World Cup,link,http://bbc.in/2al2Xr0,2016-07-25 12:53:34,1448,165,234,1168,50,8,219,2,1
228735667216_10153781806102217,Here's why Verizon  were willing to part with $4.83bn (£3.7bn) to buy Yahoo.,The end of Yahoo: Why Verizon spent big,link,http://bbc.in/2akRkAg,2016-07-25 12:24:07,1362,77,183,1224,8,58,10,56,6
228735667216_10153781713862217,You should see the length of its strings.,Giant miner puppet begins 130-mile journey,link,http://bbc.in/29Znjn0,2016-07-25 11:47:14,915,42,94,868,16,28,3,0,0
228735667216_10153781662492217,"""Old nappy box you will use.""",Star Wars action figure photos are Comic-Con winner,link,http://bbc.in/2akJmqP,2016-07-25 11:14:24,1176,44,59,1140,26,10,1,0,0
228735667216_10153781569732217,"We're #LIVE in Philadelphia at the Democratic National Convention. #BernieSanders supporters are holding a rally, expressing their dissatisfaction with Hillary Clinton. Share your questions and comments with the BBC's Rajini Vaidyanathan.",,video,https://www.facebook.com/bbcnews/videos/10153781569732217/,2016-07-25 10:41:18,4135,1530,275,3650,241,34,121,24,65
228735667216_10153781528932217,"The victims had been at an event advertised as a ""Big Mansion Pool Party"" at a ""Posh Location in the Hills"".",Man killed and two people injured in Surrey pool party shooting,link,http://bbc.in/2arNs31,2016-07-25 10:10:15,2878,250,324,2092,26,246,6,440,68
228735667216_10153781483452217,"Ten people have been killed and dozens more injured in separate gun, bomb, axe and machete attacks.

Do these incidents herald a new era of insecurity?",Germany attacks: What is going on?,link,http://bbc.in/2a4rtf5,2016-07-25 09:48:37,5418,1008,707,3276,7,52,8,1470,606
228735667216_10153781391002217,WARNING - THIS VIDEO DISCUSSES TOPICS SOME VIEWERS MAY FIND DISTRESSING. We were live discussing the practice of #FGM. Tulip Mazumdar was joined by anti-FGM campaigner Hibo Wardere answering your questions. #FacebookLive,,video,https://www.facebook.com/bbcnews/videos/10153781391002217/,2016-07-25 09:10:25,4705,989,313,4110,247,45,26,172,105
228735667216_10153781368577217,It's taken three years to construct!,Durham Cathedral Lego project completed,link,http://bbc.in/2akEnXj,2016-07-25 08:46:53,8253,362,853,7488,287,476,2,0,0
228735667216_10153781332982217,"We are live at 15:00BST Tulip Mazumdar will speak with Hibo Wardere about #FGM. If you have any questions about this practice, put them in the comments section below #FBlive",,status,,2016-07-25 08:34:23,216,28,11,214,0,1,1,0,0
228735667216_10153781290852217,"The UN says it is ""alarming and shameful"" that more Afghan children have been killed or maimed this year than in any six-month period since 2009.","Shameful rise in Afghan child deaths and injuries, UN says",link,http://bbc.in/2a5zswg,2016-07-25 08:13:55,2495,183,222,1621,5,7,2,652,208
228735667216_10153781241012217,More than $10m (£7.6m) had been budgeted to provide state-of-the-art facilities for the Hausa language film industry.,Nigeria shelves plans for 'Kannywood' film village,link,http://bbc.in/2apTAG9,2016-07-25 07:43:11,600,50,39,587,4,1,7,1,0
228735667216_10153781186622217,How to be the boss - let Lily Cole's CEO secrets be your #Mondaymotivation.,BBC Business News,video,https://www.facebook.com/bbcbusiness/videos/10153837850253129/,2016-07-25 07:07:25,623,47,0,597,13,2,11,0,0
228735667216_10153781141062217,"Sir Philip Green and others who ""got rich"" from BHS are blamed for the retailer's collapse in what MPs call the ""unacceptable face of capitalism"".","Sir Philip Green left BHS on 'life support', MPs find",link,http://bbc.in/2aFipNu,2016-07-25 06:41:11,1188,378,110,894,2,9,4,24,255
228735667216_10153781100312217,What did Xian Guolin do wrong? Open a noodle shop too close to existing ones in Shanghai. This is the story of #BeefNoodleGate,Got beef? How one man faced down a 'noodle cartel',link,http://bbc.in/2a3Y9Ft,2016-07-25 06:14:36,1230,50,64,1175,6,25,22,1,1
228735667216_10153781071827217,"Syreeta Gary's daughter was at the club and at one point ""dodging bullets and running, dropping between cars.""",Florida nightclub shooting: Two dead and 16 injured in Fort Myers,link,http://bbc.in/2a5qRKc,2016-07-25 05:47:59,1446,134,430,814,4,30,0,429,169
228735667216_10153781027617217,Twenty years ago Damien vanished on a night out in Cowes on the Isle of Wight. BBC Three reporters have spent months reinvestigating the case.,Damien Nettles: The boy who disappeared,link,http://bbc.in/29YXNhS,2016-07-25 05:11:48,1773,121,145,1530,7,34,2,197,3
228735667216_10153780951967217,"Prince Harry opens up to Rio Ferdinand about his regret at not talking about the death of his mother, Princess Diana. You can watch more in our report on the event for mental health charity Heads Together http://bbc.in/2akfR8w","""I really regret not talking about it for the first 28 years o...",video,https://www.facebook.com/bbcnews/videos/10153780951967217/,2016-07-25 04:36:26,4991,207,487,4186,337,16,3,448,1
228735667216_10153780847922217,Is visual searching the next big thing? The augmented reality app #Blippar is valued at more than one billion dollars. Ben Thompson from BBC Business News was joined by the company's co-founder Jess Butcher answering your questions. #FacebookLive,,video,https://www.facebook.com/bbcnews/videos/10153780847922217/,2016-07-25 03:57:20,7553,1418,656,6918,374,138,44,32,47
228735667216_10153780830232217,"One person has been killed and 17 people shot - local media reports.

UPDATE: Police confirm two dead, 14-16 hurt.",Shootings reported at Florida nightclub,link,http://bbc.in/2apwsYo,2016-07-25 03:41:49,20977,1971,8755,10192,40,635,41,6640,3429
228735667216_10153780748702217,Salman Khan was accused of shooting and killing endangered animals in 1998.,Bollywood's Salman Khan freed in poaching case,link,http://bbc.in/2ajVZlV,2016-07-25 03:01:02,3991,235,81,3574,16,27,68,19,287
228735667216_10153780693562217,Should parents limit how much they mention their kids at work?,Is it a mistake to talk about your children at work?,link,http://bbc.in/2a4W93M,2016-07-25 02:28:09,3167,755,235,2950,27,36,132,6,16
228735667216_10153780654232217,Many have described Narasimha Rao as India's answer to Deng Xiaoping.,Reassessing India's 'forgotten prime minister',link,http://bbc.in/2aaRyeb,2016-07-25 01:52:06,1494,58,83,1456,24,12,1,0,1
228735667216_10153780622972217,The boy died in a suspected drowning.,Bosworth Water Park death: Two people released on bail,link,http://bbc.in/2anoxOj,2016-07-25 01:26:11,1545,81,46,1072,7,8,0,419,39
228735667216_10153780589192217,Carried out by a failed Syrian asylum seeker who was refused entry.,Ansbach blast: Suicide bomb at German music festival,link,http://bbc.in/2a4I6eO,2016-07-25 01:02:32,3857,439,904,2053,6,67,4,974,753
228735667216_10153780545612217,"""It is OK to suffer, but as long as you talk about it.""",Prince Harry 'regrets not speaking about Princess Diana's death',link,http://bbc.in/29UgCqG,2016-07-25 00:22:30,20409,442,2567,17397,1178,32,10,1785,8
228735667216_10153780511382217,Paving the way for a more democratic Myanmar?,Can Aung San Suu Kyi and Myanmar's top general bring greater democracy?,link,http://bbc.in/2ajFFBG,2016-07-24 23:49:39,2546,101,110,2496,23,15,3,1,8
228735667216_10153780470262217,Malcolm Turnbull's proposed changes come after attacks in the US and France.,Australian PM pushes tough anti-terror laws,link,http://bbc.in/2ajF4QC,2016-07-24 23:22:50,2453,144,118,2372,57,15,3,2,4
228735667216_10153780438532217,The pair were attacked after leaving their vehicle.,Tigers maul women at Beijing wildlife park,link,http://bbc.in/2ajE7aO,2016-07-24 22:56:25,609,71,37,545,1,21,6,34,2
228735667216_10153780400957217,The 27-year-old was granted temporary leave to remain.,Failed Syria asylum seeker behind Ansbach blast,link,http://bbc.in/2aaO62Y,2016-07-24 22:35:34,1854,232,258,1301,7,19,3,212,312
228735667216_10153780353677217,The man detonated a backpack device after being refused entry to a music festival.,Germany blast: Syrian migrant 'behind Ansbach explosion',link,http://bbc.in/2a4BNrh,2016-07-24 22:09:05,4454,721,1159,2614,8,82,20,784,946
228735667216_10153779643827217,"Amid a sea of Turkish flags in Istanbul, banners bore slogans such as ""We defend the republic!""",Turkey failed coup: Tens of thousands in pro-democracy rally,link,http://bbc.in/2a3YjAG,2016-07-24 15:44:22,3683,390,242,3436,107,19,88,21,12
228735667216_10153779579702217,"This small Ohio county has picked the eventual US president since 1964.
This year, they're leaning towards Donald J. Trump.
http://bbc.in/29Y0y3D",US Elections: The Ohio county that picks presidents is leaning...,video,https://www.facebook.com/bbcnews/videos/10153779579702217/,2016-07-24 15:16:27,1954,423,251,1288,78,75,47,271,195
228735667216_10153779452902217,"What happened to a 16-year-old boy who went missing in 1996? Twenty years on, the case is unsolved. We played the first episode of BBC Three series #Unsolved live here. Journalists Alys Harte and Bronagh Munro, who investigated the teenager's disappearance watched with you - and shared their thoughts in the comments below. Watch again and let us know what you think.",Unsolved: The boy who disappeared,video,https://www.facebook.com/bbcnews/videos/10153779452902217/,2016-07-24 14:33:06,7444,1103,930,6377,310,82,30,600,45
228735667216_10153779423242217,"""You don't want to come back and make one that's not very good.""","Paul Greengrass on the ""terror"" of returning for Jason Bourne",link,http://bbc.in/2a2p3xz,2016-07-24 14:04:18,1167,81,29,1147,11,2,7,0,0
228735667216_10153779370452217,Witnesses said the attack happened after an argument.,Germany machete attack: Syria migrant 'kills woman',link,http://bbc.in/2aE9ID9,2016-07-24 13:42:59,9011,1272,1216,5363,27,139,33,1666,1783
228735667216_10153779280637217,"""My granddad never stopped talking about meeting Pele.""",Did the 1966 World Cup change England?,link,http://bbc.in/2a9P5kd,2016-07-24 13:12:28,1711,144,48,1680,7,9,15,0,0
228735667216_10153779250552217,"We asked Republican delegates in Cleveland for specifics on how they think Trump should (or could) build a wall along the US - Mexico border. 
http://bbc.in/29PudQ3",US Elections: How would Trump build his wall?,video,https://www.facebook.com/bbcnews/videos/10153779250552217/,2016-07-24 13:01:15,2099,725,1015,1119,18,328,466,71,97
228735667216_10153779178157217,"""Goodbye old Shawshank oak. You will live on in nostalgia.""",Tree from Shawshank Redemption falls and fans grieve,link,http://bbc.in/29XDVvr,2016-07-24 12:39:55,4131,252,548,2999,15,141,22,949,5
228735667216_10153779094847217,"Following the Brexit vote, the UK Chancellor said it was time to explore ""new opportunities"" across the world.",UK explores multi-billion pound free trade deal with China,link,http://bbc.in/2a2yBIS,2016-07-24 12:10:29,5733,508,469,5256,135,53,219,19,51
228735667216_10153778994042217,Wildfires have also forced the evacuation of about 400 animals from a rescue shelter.,California wildfires force hundreds to flee homes,link,http://bbc.in/2aiGgnk,2016-07-24 11:26:16,3178,107,214,2448,4,146,1,578,1
228735667216_10153778916277217,"""Blocked toilets, leaking pipes, exposed wiring"" - just some of the problems Australia has found, with 12 days until the Games open.",Australia refuse to move into Olympics athletes' village,link,http://bbc.in/2a9QlDI,2016-07-24 10:51:08,9812,654,1291,7450,40,1204,409,551,158
228735667216_10153778833052217,Seven were teenagers. Three were just 14 years old.,Who were the Munich shooting victims?,link,http://bbc.in/29XpE1W,2016-07-24 10:14:38,11610,431,666,5002,30,46,9,5542,981
228735667216_10153778772297217,One woman was killed when she left the car to try to help her friend.,Tigers maul two women at Beijing wildlife park,link,http://bbc.in/2alUnuM,2016-07-24 09:44:08,9151,1380,1246,6548,54,957,178,1327,87
228735667216_10153778693247217,"It will be up to individual sports' governing bodies to determine if Russian competitors are clean, an Olympic source has told the BBC.",Rio Olympics 2016: Russia not given blanket ban by IOC,link,http://bbc.in/2aiqHfk,2016-07-24 08:59:03,2668,446,232,2180,28,85,34,10,331
228735667216_10153778618562217,"""We got some bats and balls and played a spot of tennis over the central reservation. We made the best of it.""",Motorists find ways to cope with Dover delays,link,http://bbc.in/2a9CBJ5,2016-07-24 08:13:23,3135,139,121,2864,21,61,174,12,3
228735667216_10153778553132217,"Nine people died, seven of them teenagers, and 35 people were injured in Friday's attack.",Munich shooting: Gunman 'planned attack for year',link,http://bbc.in/29Xej1A,2016-07-24 07:39:10,6436,392,406,3719,17,34,6,2096,564
228735667216_10153778480167217,"With modern treatments needing less professional maintenance, the trend away from the shampoo and set is hitting hairdressers hard.",Wave goodbye: The end of the shampoo and set,link,http://bbc.in/2a9s5l9,2016-07-24 06:46:06,2147,184,305,2016,13,17,38,62,1
228735667216_10153778428632217,Police have warned delays at the Port of Dover could last until Monday.,Dover delays: Motorists hit by second day of disruption,link,http://bbc.in/29T6m1P,2016-07-24 06:11:50,1006,119,214,879,6,74,23,16,8
228735667216_10153778393392217,"As Kabul prepares to bury 80 people killed by a suicide bomber, some families are still looking for missing loved ones.",Tense Afghan capital set to bury Kabul blast victims,link,http://bbc.in/2aphYdC,2016-07-24 05:43:02,13833,580,898,6957,30,32,16,6088,710
228735667216_10153778361372217,"Kate, who was 34, reached her target just three days ago.",Doctor Kate Granger dies after hitting £250k cancer charity goal,link,http://bbc.in/2a9pfwp,2016-07-24 05:15:00,14837,505,1360,8447,708,69,11,5592,10
228735667216_10153778308487217,The Munich gunman had a Glock pistol and more than 300 bullets.,Calls for tighter gun laws after Munich mall attack,link,http://bbc.in/2a1Xu7x,2016-07-24 04:39:52,7802,766,392,6102,41,37,39,1246,337
228735667216_10153778238407217,"""I've now got a member of staff...worried she's going to lose her job and face prosecution because it's been describred as a break-in.""

Labour's John McDonnell responds to Seema Malhotra's complaint that a Jeremy Corbyn aide entered her office without permission.
bbc.in/29SKjbQ",John McDonnell on Seema Malhotra row,video,https://www.facebook.com/bbcnews/videos/10153778238407217/,2016-07-24 04:06:25,1518,362,185,1387,19,12,41,9,50
228735667216_10153778152252217,"TV ""love team"" #AlDub is a Philippine phenomenon that has smashed social media records. But who are they? We met one half of the duo Alden Richards as he staged his first solo concert in Singapore. 👋🏼 #ALDUB1stAnniversary",,video,https://www.facebook.com/bbcnews/videos/10153778152252217/,2016-07-24 03:05:32,12321,2770,1402,9702,2137,215,160,28,79
228735667216_10153778127392217,"Seema Malhotra said the ""privacy, security and confidentiality"" of her office had been violated.",Labour MP accuses Corbyn aide over office entry,link,http://bbc.in/2a1QA22,2016-07-24 02:44:37,1817,606,120,1609,9,15,106,7,71
228735667216_10153778091647217,Drivers have faced delays of up to 14 hours.,UK border staff to help tackle Dover queues,link,http://bbc.in/2a1ONdx,2016-07-24 02:13:43,8125,699,1327,6472,25,1160,281,94,93
228735667216_10153777203447217,"With America's population changing, critics say Donald J. Trump needs to do much more to broaden his appeal to win the White House. Can he?
http://bbc.in/2acwi73",US Elections: Can Trump win with white voters only?,video,https://www.facebook.com/bbcnews/videos/10153777203447217/,2016-07-23 16:01:09,1543,562,148,1320,14,10,81,12,106
228735667216_10153776679867217,Donald J. Trump is officially the Republican party's candidate - but winning America over could hinge on one key factor: demographics.,Can Trump win with white voters only?,link,http://bbc.in/29RfDYg,2016-07-23 11:36:24,4169,1366,204,3597,44,21,248,45,214
228735667216_10153776561952217,Five ways the Great Fire changed London http://bbc.in/2a0GK0q,,video,https://www.facebook.com/bbcnews/videos/10153776561952217/,2016-07-23 10:30:57,11946,318,3280,11080,182,651,4,25,4
228735667216_10153776480312217,David Cameron appealed for limits on the free movement of people - but later changed his mind. #Brexit,Brexit: Cameron considered last-ditch appeal to Merkel,link,http://bbc.in/2a0PxmX,2016-07-23 09:44:13,2253,206,122,2156,20,8,55,4,10
228735667216_10153776353337217,"In 1996 a 16-year-old boy went missing. Twenty years later, the case is #Unsolved. Watch the first episode here EXCLUSIVELY on Sunday",,video,https://www.facebook.com/bbcnews/videos/10153776353337217/,2016-07-23 08:47:09,1202,94,147,1114,15,35,3,33,2
228735667216_10153776294202217,The BBC's Andrew Plant was live in Munich the day after a shooting spree by an 18-year-old left nine dead and 27 injured. Police are currently investigating if the gunman may have lured his victims through a Facebook invitation to a restaurant.,,video,https://www.facebook.com/bbcnews/videos/10153776294202217/,2016-07-23 08:30:01,9144,1613,826,6608,322,89,29,1711,385
228735667216_10153776288497217,Thousands of people were protesting against a new power line - when suicide bombers attacked.,Kabul explosion: Islamic State claims attack which kills at least 61,link,http://bbc.in/2a7TYtI,2016-07-23 08:25:31,19320,1095,3727,8539,25,109,31,7469,3147
228735667216_10153776245772217,"""We are in profound mourning"" - Angela Merkel on the #Munich shooting bbc.in/2a4WVbS",Angela Merkel on Munich shooting,video,https://www.facebook.com/bbcnews/videos/10153776245772217/,2016-07-23 08:08:00,7440,795,604,4534,34,25,22,2343,482
228735667216_10153776168627217,"Ottawa County in Ohio has voted for the eventual President since 1964.
And they're predicting a President Donald J. Trump come November.",The Ohio county that picks presidents is leaning Trump,link,http://bbc.in/2amWvSF,2016-07-23 07:21:11,4967,865,397,3344,189,121,131,605,577
228735667216_10153776121377217,"UPDATE: The coach was carrying pupils from school in Cheltenham, it has emerged. Two people are seriously injured.",'13 injured' in France coach crash - local media reports,link,http://bbc.in/2ajbqxF,2016-07-23 06:43:22,4965,232,586,3176,20,207,5,1527,30
228735667216_10153776089277217,"Up, up and away!",Russian balloonist 'breaks Fossett's round-the-world record',link,http://bbc.in/2aCbF37,2016-07-23 06:20:47,2196,131,89,2079,36,75,5,0,1
228735667216_10153776054162217,"""It's absolutely horrendous. We have maybe moved half a mile in the last eight hours.""",Dover ferry passengers delayed by French security checks,link,http://bbc.in/2a0TsjV,2016-07-23 05:53:57,5742,1059,1115,4441,34,698,352,115,102
228735667216_10153776000932217,"#Munich Shooting: Gunman had no apparent ties to the Islamic State group and was obsessed with mass shootings, German police say bbc.in/2a4WVbS",,video,https://www.facebook.com/bbcnews/videos/10153776000932217/,2016-07-23 05:10:59,3366,545,663,2304,9,34,16,718,285
228735667216_10153775890642217,"More than 1,000 private schools and 1,200 associations are also ordered to be closed.",Turkey extends coup suspects' detention up to 30 days,link,http://bbc.in/2a0S7JQ,2016-07-23 04:04:56,3203,539,308,2366,32,62,31,262,450
228735667216_10153775810137217,"Police want people to send them any videos, photos or audio recordings of the shooting.",Munich shooting: Police appeal for video evidence,link,http://bbc.in/2a0M4oy,2016-07-23 02:43:10,2849,259,162,2545,5,10,3,207,79
228735667216_10153775472942217,"#AlDub fans: Get ready for our #FacebookLive with Alden Richards here on 24 July. 

What do you want us to ask your star? #ALDUBSuperMA #ALDUBSakLOLA #ALDUBGetThemLolaTini #ALDUB1stAnniversary #ALDUBImagineYouAndMe",AlDub: The social media phenomenon about love and lip-synching,link,http://bbc.in/2a0iuQc,2016-07-22 23:05:09,1202,103,70,1167,12,15,7,0,1
228735667216_10153775321052217,No words.,World's 'saddest' polar bear kept in China mall for selfies,link,http://bbc.in/29RdmMJ,2016-07-22 21:10:29,101248,7637,13927,27930,174,258,85,34309,38492
228735667216_10153775164132217,The suspect was an 18-year-old German-Iranian but his motive is unclear.,"Munich shooting: Gunman acted alone, say police",link,http://bbc.in/29UC6zx,2016-07-22 20:04:17,11343,1101,1306,8090,17,107,23,1836,1270
228735667216_10153775122682217,"""He's with her.""",Hillary Clinton selects Tim Kaine as her running mate,link,http://bbc.in/2a0eteu,2016-07-22 19:38:02,7695,651,427,6996,277,31,227,31,133
228735667216_10153775070307217,"The Gouster is described as ""40 minutes of glorious funk"".",Previously unreleased Bowie album to feature in box set,link,http://bbc.in/2ajuzMB,2016-07-22 19:01:24,2863,152,366,2672,134,52,3,2,0
228735667216_10153774929767217,"People in Munich are using #OffeneTuer, or ""open door"", to help people caught up in the attacks. The city's mosques are also staying open to offer shelter: http://bbc.in/29Uqz2R

Follow the latest on the manhunt: http://bbc.in/2a6QKXp",Munich manhunt after deadly shooting,link,http://bbc.in/2a6QzeP,2016-07-22 17:37:22,2590,190,360,1985,21,14,2,436,132
